{
  "schema_version": "1.0.0",
  "gate": "6D",
  "subgate": "6D3",
  "status": "closed",
  "retained_model": "v1_frozen_champion",
  "candidate_decisions": [
    {
      "candidate_id": "chronos_2_zero_shot",
      "decision": "reject",
      "promotion_eligible": false,
      "research_only_negative_benchmark": false
    },
    {
      "candidate_id": "timesfm_2_5_zero_shot",
      "decision": "reject",
      "promotion_eligible": false,
      "research_only_negative_benchmark": false
    },
    {
      "candidate_id": "moirai_2_research_zero_shot",
      "decision": "reject",
      "promotion_eligible": false,
      "research_only_negative_benchmark": true
    }
  ],
  "validation_summary": {
    "candidate_count": 3,
    "outer_fold_count": 4,
    "prediction_row_count": 21012,
    "validation_origins_per_candidate": 7004,
    "eligible_candidate_count": 0,
    "total_positive_outer_folds": 0,
    "strongest_candidate": "chronos_2_zero_shot",
    "strongest_candidate_mean_mae": 4.743580802977936,
    "total_wall_clock_seconds": 1027.9014912339999
  },
  "controls": {
    "human_decision_recorded": true,
    "automatic_promotion_permitted": false,
    "locked_test_accessed": false,
    "locked_predictions_parsed": false,
    "confirmatory_evaluation_performed": false,
    "fine_tuning_performed": false,
    "calibration_performed": false,
    "hyperparameter_search_performed": false,
    "v1_immutable": true,
    "rescue_lane_opened": false,
    "probabilistic_authority_claimed": false,
    "commercial_license_boundary_preserved": true,
    "gate_6e_unblocked": true
  },
  "source_hashes": {
    "candidate_results": "bff658b8d896c90b4a69f497d40a591697eaa8e07c1aff9bb4e970ff389aa702",
    "outer_fold_results": "f01b8c04ba7f72ecd3c9f16ad35edb4e15e96064ccb7f49ac63877a5d6f6429c",
    "out_of_fold_predictions": "c7b15d823a95767b8c97f99fcd4567b27f249fa64aa4064099dbdeffddb8cc73",
    "resource_evidence": "faab2aae0735395e3fa259de587f5185819ea6426a06b3b072e7a753d43948fe",
    "model_provenance_manifest": "b6e11cf062d40fc703b29251605e81598cbf06b0753f90f482f79d113e57cb0d",
    "failure_records": "782f67225c9f9c156adb4003744f2cfe111947c92a8434edc7457b0d0d093afe",
    "promotion_recommendation": "5198ba7be7be9b256ef8bf1be26542c54c567f25592c3f379c98596e69287847"
  },
  "environment_hashes": {
    "chronos_2_zero_shot.txt": "bef86b1910752a4f64f8a68850e40bf1f24a25bde5bd3b7a84535f7c7fd73959",
    "timesfm_2_5_zero_shot.txt": "d46f9f3e66e77e60d2fb4a459e68d5e2f6546f940273954a716df0efc942be1a",
    "moirai_2_research_zero_shot.txt": "d0553c8952263a973983a006ab7ddd8182314bb7c908b5651a324502165ed8c3"
  },
  "decision_record_path": "outputs/v2/gate_6d/promotion_decision.json",
  "execution_manifest_path": "outputs/v2/gate_6d/gate_6d_execution_manifest.json",
  "next_gate": "6E",
  "blocked_gates": [
    "6F",
    "6G"
  ]
}
